[
  {
    "id": "ev01",
    "name": "game_boot",
    "parameters": [
      "boot_outcome",
      "startup_ms",
      "save_version"
    ],
    "origin": "client",
    "delivery": "consent-gated behavioral telemetry",
    "common_envelope": [
      "event_id",
      "app_version",
      "balance_version",
      "environment",
      "session_id"
    ],
    "notes": "High-cardinality IDs stay in raw export, not GA4 custom dimensions. No email, purchase token, full order ID, ad ID, or free text."
  },
  {
    "id": "ev02",
    "name": "tutorial_step",
    "parameters": [
      "step_id",
      "outcome"
    ],
    "origin": "client",
    "delivery": "consent-gated behavioral telemetry",
    "common_envelope": [
      "event_id",
      "app_version",
      "balance_version",
      "environment",
      "session_id"
    ],
    "notes": "High-cardinality IDs stay in raw export, not GA4 custom dimensions. No email, purchase token, full order ID, ad ID, or free text."
  },
  {
    "id": "ev03",
    "name": "view_open",
    "parameters": [
      "view_id",
      "entry_reason"
    ],
    "origin": "client",
    "delivery": "consent-gated behavioral telemetry",
    "common_envelope": [
      "event_id",
      "app_version",
      "balance_version",
      "environment",
      "session_id"
    ],
    "notes": "High-cardinality IDs stay in raw export, not GA4 custom dimensions. No email, purchase token, full order ID, ad ID, or free text."
  },
  {
    "id": "ev04",
    "name": "army_changed",
    "parameters": [
      "loadout_id",
      "slot",
      "unit_id"
    ],
    "origin": "client",
    "delivery": "consent-gated behavioral telemetry",
    "common_envelope": [
      "event_id",
      "app_version",
      "balance_version",
      "environment",
      "session_id"
    ],
    "notes": "High-cardinality IDs stay in raw export, not GA4 custom dimensions. No email, purchase token, full order ID, ad ID, or free text."
  },
  {
    "id": "ev05",
    "name": "expedition_start",
    "parameters": [
      "expedition_id",
      "run_id",
      "loadout_id",
      "is_replay"
    ],
    "origin": "client",
    "delivery": "consent-gated behavioral telemetry",
    "common_envelope": [
      "event_id",
      "app_version",
      "balance_version",
      "environment",
      "session_id"
    ],
    "notes": "High-cardinality IDs stay in raw export, not GA4 custom dimensions. No email, purchase token, full order ID, ad ID, or free text."
  },
  {
    "id": "ev06",
    "name": "expedition_resume",
    "parameters": [
      "expedition_id",
      "run_id",
      "checkpoint_kind"
    ],
    "origin": "client",
    "delivery": "consent-gated behavioral telemetry",
    "common_envelope": [
      "event_id",
      "app_version",
      "balance_version",
      "environment",
      "session_id"
    ],
    "notes": "High-cardinality IDs stay in raw export, not GA4 custom dimensions. No email, purchase token, full order ID, ad ID, or free text."
  },
  {
    "id": "ev07",
    "name": "expedition_end",
    "parameters": [
      "expedition_id",
      "run_id",
      "outcome",
      "battles_won",
      "active_seconds"
    ],
    "origin": "client",
    "delivery": "consent-gated behavioral telemetry",
    "common_envelope": [
      "event_id",
      "app_version",
      "balance_version",
      "environment",
      "session_id"
    ],
    "notes": "High-cardinality IDs stay in raw export, not GA4 custom dimensions. No email, purchase token, full order ID, ad ID, or free text."
  },
  {
    "id": "ev08",
    "name": "battle_start",
    "parameters": [
      "encounter_id",
      "run_id",
      "attempt_id",
      "loadout_id",
      "build_id"
    ],
    "origin": "client",
    "delivery": "consent-gated behavioral telemetry",
    "common_envelope": [
      "event_id",
      "app_version",
      "balance_version",
      "environment",
      "session_id"
    ],
    "notes": "High-cardinality IDs stay in raw export, not GA4 custom dimensions. No email, purchase token, full order ID, ad ID, or free text."
  },
  {
    "id": "ev09",
    "name": "battle_end",
    "parameters": [
      "encounter_id",
      "run_id",
      "attempt_id",
      "outcome",
      "duration_s",
      "base_hp_fraction",
      "enemy_base_hp_fraction",
      "supply_spent",
      "supply_wasted",
      "peak_units"
    ],
    "origin": "client",
    "delivery": "consent-gated behavioral telemetry",
    "common_envelope": [
      "event_id",
      "app_version",
      "balance_version",
      "environment",
      "session_id"
    ],
    "notes": "High-cardinality IDs stay in raw export, not GA4 custom dimensions. No email, purchase token, full order ID, ad ID, or free text."
  },
  {
    "id": "ev10",
    "name": "battle_unit_summary",
    "parameters": [
      "attempt_id",
      "unit_id",
      "side",
      "spawned",
      "damage_units",
      "damage_base",
      "deaths",
      "time_alive_s"
    ],
    "origin": "client",
    "delivery": "consent-gated behavioral telemetry",
    "common_envelope": [
      "event_id",
      "app_version",
      "balance_version",
      "environment",
      "session_id"
    ],
    "notes": "High-cardinality IDs stay in raw export, not GA4 custom dimensions. No email, purchase token, full order ID, ad ID, or free text."
  },
  {
    "id": "ev11",
    "name": "battle_interrupted",
    "parameters": [
      "attempt_id",
      "cause",
      "elapsed_s"
    ],
    "origin": "client",
    "delivery": "consent-gated behavioral telemetry",
    "common_envelope": [
      "event_id",
      "app_version",
      "balance_version",
      "environment",
      "session_id"
    ],
    "notes": "High-cardinality IDs stay in raw export, not GA4 custom dimensions. No email, purchase token, full order ID, ad ID, or free text."
  },
  {
    "id": "ev12",
    "name": "rally_summary",
    "parameters": [
      "attempt_id",
      "uses",
      "first_use_s",
      "active_s"
    ],
    "origin": "client",
    "delivery": "consent-gated behavioral telemetry",
    "common_envelope": [
      "event_id",
      "app_version",
      "balance_version",
      "environment",
      "session_id"
    ],
    "notes": "High-cardinality IDs stay in raw export, not GA4 custom dimensions. No email, purchase token, full order ID, ad ID, or free text."
  },
  {
    "id": "ev13",
    "name": "draft_offered",
    "parameters": [
      "run_id",
      "draft_id",
      "option_1",
      "option_2",
      "option_3",
      "offer_ordinal"
    ],
    "origin": "client",
    "delivery": "consent-gated behavioral telemetry",
    "common_envelope": [
      "event_id",
      "app_version",
      "balance_version",
      "environment",
      "session_id"
    ],
    "notes": "High-cardinality IDs stay in raw export, not GA4 custom dimensions. No email, purchase token, full order ID, ad ID, or free text."
  },
  {
    "id": "ev14",
    "name": "draft_chosen",
    "parameters": [
      "run_id",
      "draft_id",
      "upgrade_id",
      "decision_ms",
      "offer_ordinal"
    ],
    "origin": "client",
    "delivery": "consent-gated behavioral telemetry",
    "common_envelope": [
      "event_id",
      "app_version",
      "balance_version",
      "environment",
      "session_id"
    ],
    "notes": "High-cardinality IDs stay in raw export, not GA4 custom dimensions. No email, purchase token, full order ID, ad ID, or free text."
  },
  {
    "id": "ev15",
    "name": "draft_reroll",
    "parameters": [
      "run_id",
      "draft_id",
      "source",
      "reward_id"
    ],
    "origin": "client",
    "delivery": "consent-gated behavioral telemetry",
    "common_envelope": [
      "event_id",
      "app_version",
      "balance_version",
      "environment",
      "session_id"
    ],
    "notes": "High-cardinality IDs stay in raw export, not GA4 custom dimensions. No email, purchase token, full order ID, ad ID, or free text."
  },
  {
    "id": "ev16",
    "name": "medals_changed",
    "parameters": [
      "transaction_id",
      "source_or_sink",
      "amount",
      "balance_after"
    ],
    "origin": "client",
    "delivery": "consent-gated behavioral telemetry",
    "common_envelope": [
      "event_id",
      "app_version",
      "balance_version",
      "environment",
      "session_id"
    ],
    "notes": "High-cardinality IDs stay in raw export, not GA4 custom dimensions. No email, purchase token, full order ID, ad ID, or free text."
  },
  {
    "id": "ev17",
    "name": "unlock_complete",
    "parameters": [
      "unlock_id",
      "medal_cost"
    ],
    "origin": "client",
    "delivery": "consent-gated behavioral telemetry",
    "common_envelope": [
      "event_id",
      "app_version",
      "balance_version",
      "environment",
      "session_id"
    ],
    "notes": "High-cardinality IDs stay in raw export, not GA4 custom dimensions. No email, purchase token, full order ID, ad ID, or free text."
  },
  {
    "id": "ev18",
    "name": "shop_view",
    "parameters": [
      "entry_point",
      "remaining_medal_unlocks"
    ],
    "origin": "client",
    "delivery": "consent-gated behavioral telemetry",
    "common_envelope": [
      "event_id",
      "app_version",
      "balance_version",
      "environment",
      "session_id"
    ],
    "notes": "High-cardinality IDs stay in raw export, not GA4 custom dimensions. No email, purchase token, full order ID, ad ID, or free text."
  },
  {
    "id": "ev19",
    "name": "reward_offer",
    "parameters": [
      "placement_id",
      "run_id",
      "reward_id",
      "eligible"
    ],
    "origin": "client",
    "delivery": "consent-gated behavioral telemetry",
    "common_envelope": [
      "event_id",
      "app_version",
      "balance_version",
      "environment",
      "session_id"
    ],
    "notes": "High-cardinality IDs stay in raw export, not GA4 custom dimensions. No email, purchase token, full order ID, ad ID, or free text."
  },
  {
    "id": "ev20",
    "name": "reward_request",